Keyword;Search Volume;CPC;Competition
mental health answering service;140;0;0
mental health answering service pricing per month;110;0;0
answering services for mental health practices;50;0;0.86
mental health answering service pricing per month 1500;50;0;0
answering service for mental health professionals;40;0;0
mental health practice answering service pricing per month;40;0;0
mental health answering service joke;20;0;0.33
mental health practice answering service cost per month;20;0;0
mental health answering services;10;0;0
mental health practice answering service pricing per month 1500;10;0;0
24 hour answering service for mental health;0;0;0
ai answering service for mental health providers;0;0;0
answering service for mental health;0;0;0
answering service for mental health practices;0;0;0
answering service mental health;0;0;0
best mental health answering service;0;0;0
icevonline answers key counseling & mental health services;0;0;0
live answering service for mental health providers;0;0;0
live answering service mental health;0;0;0
mental health hotline answering service;0;0;0