Keyword;Search Volume;CPC;Competition
digital marketing services;40500;8.39;0.08
digital marketing service;5400;8.39;0.08
digital marketing agency services;3600;7.91;0.08
digital marketing services near me;3600;10;0.08
full service digital marketing agency;3600;13.04;0.06
digital marketing services for small business;2400;10.06;0.05
b2b digital marketing services;1900;0;0.07
digital marketing consulting services;1600;13.91;0.01
digital marketing for home services;1300;8.09;0.06
digital marketing services company;1300;10.1;0.03
digital marketing and seo services;1000;10.87;0.14
digital services marketing;1000;8.39;0.08
digital+marketing+for+professional+services;1000;10.74;0.06
full service digital marketing;1000;10.83;0.06
home services digital marketing;1000;6.41;0.08
seo and digital marketing services;1000;10.87;0.14
tarifs services marketing digital 2026;1000;0;0
digital marketing for financial services;880;8.92;0.07
digital marketing seo services;880;10.87;0.14
healthcare digital marketing services;880;0;0.04