Keyword;Search Volume;CPC;Competition
medical answering service;2900;8.12;0.33
medical answering services;2900;8.12;0.33
after hours answering services for medical offices;1000;54.45;0.64
medical office answering service;880;49.75;0.28
after hours medical answering service;480;0;0.25
answering service for medical office;480;49.75;0.28
automated medical answering services;480;39.81;0.04
best medical answering service;480;63.42;0.41
medical after hours answering service;480;43.09;0.53
medical answering service pricing;480;0;0.07
answering services for medical offices;390;57.62;0.45
hipaa compliant medical answering service;390;0;0.02
medical answering service login;390;8.99;0.02
medical telephone answering service;390;0;0.12
medical answering service companies;320;0;0.09
medical answering service cost;320;0;0.07
medical call answering service;320;44.26;0.6
medical phone answering service;320;121.38;0.27
answering service medical;260;31.24;0.42
automated medical answering service;260;39.81;0.04