Keyword;Search Volume;CPC;Competition
ai outbound calling;390;27.54;0.6
can ai agents make outbound calls;390;0;0
can ai agents make outbound calls illegal;390;0;0
ai outbound sales calls;170;0;0.11
ai outbound call;140;27.54;0.6
ai outbound calling agents;140;36.25;0.94
what voice ai works best for outbound sales calls;140;0;0
best voice ai api for outbound and inbound calling;110;0;0
best voice ai for outbound sales calls 2025;110;0;0
outbound ai calling;110;24.16;0.89
outbound call ai;90;30.34;0.44
ai agent for outbound calls;70;22.37;0.84
ai outbound call agent;70;36.25;0.94
ai outbound calling bot;70;27.41;0.57
ai outbound calls;70;27.54;0.6
best ai voice solution for outbound calls;70;0;0
outbound ai caller;70;24.16;0.89
ai outbound calling news;50;0;0
best ai solutions optimizing inbound and outbound call experiences;50;0;0
best conversational ai platforms for outbound calls 2025;50;0;0