url,section,title,description,h1,h2_count
https://attio.com/,home,Attio: Ask more from CRM,"Powerful, flexible and data-driven, Attio makes it easy to build the exact CRM your business needs.",The revenue platform engineered for scale.,13
https://attio.com/apps,apps,App Store | Attio,Discover new apps to help you work more efficiently on Attio.,Apps & integrations,11
https://attio.com/apps/aircall,apps,Aircall Integration | Attio,Make phone calls and keep your CRM in sync,Aircall,9
https://attio.com/apps/amie,apps,Amie Integration | Attio,Record meetings and sync AI summaries,Amie,9
https://attio.com/apps/arcade-dev,apps,Arcade.dev Integration | Attio,Securely connect AI agents to Attio,Arcade.dev,9
https://attio.com/apps/arka-analytics,apps,Arka Analytics Integration | Attio,Copilot & Analytics for Attio,Arka Analytics,9
https://attio.com/apps/aside,apps,Caret Integration | Attio,Live answer copilot for enterprise tech sales,Caret,9
https://attio.com/apps/attibooks,apps,Attibooks Integration | Attio,Create and sync QuickBooks invoices from any Attio record,Attibooks,9
https://attio.com/apps/audit,apps,Audit Integration | Attio,Stop guessing how messy your Attio is,Audit,9
https://attio.com/apps/autoscaled,apps,AutoScaled Integration | Attio,Generate personalized sales presentations from Attio data,AutoScaled,9
https://attio.com/apps/azava,apps,Azava Integration | Attio,Automatically send dealflow to your CRM,Azava,9
https://attio.com/apps/bound,apps,Bound Integration | Attio,Bound is your FX copilot,Bound,9
https://attio.com/apps/caddie-ai,apps,Caddie AI Integration | Attio,Your personal AI agent that learns and works like you.,Caddie AI,9
https://attio.com/apps/caretta,apps,Caretta Integration | Attio,Sales Call Assistant for Top Reps,Caretta,9
https://attio.com/apps/chatgpt,apps,ChatGPT Integration | Attio,Bring your Attio CRM into ChatGPT,ChatGPT,9
https://attio.com/apps/circleback,apps,Circleback Integration | Attio,AI-powered meeting notes and automations.,Circleback,9
https://attio.com/apps/civic-iq,apps,Civic IQ Integration | Attio,Intent Signals for Gov Sellers,Civic IQ,9
https://attio.com/apps/claap,apps,Claap Integration | Attio,Automate call transcription and data population with Claap.,Claap,9
https://attio.com/apps/claude,apps,Claude Integration | Attio,"Search, manage, and update Attio from Claude",Claude,9
https://attio.com/apps/cometly,apps,Cometly Integration | Attio,AI Marketing Attribution & Analytics Software,Cometly,9
https://attio.com/apps/composio,apps,Composio Integration | Attio,Skip the specs — seamlessly integrate any tool you need,Composio,9
https://attio.com/apps/convo,apps,Convo Integration | Attio,Meeting intelligence that automates your follow-up work,Convo,9
https://attio.com/apps/cotera,apps,Cotera Pre Meeting Research Integration | Attio,Get a dossier on the person you're meeting with.,Cotera Pre Meeting Research,9
https://attio.com/apps/default,apps,Default Integration | Attio,"Automate inbound scheduling, routing & enrichment workflows",Default,9
https://attio.com/apps/den,apps,Den Integration | Attio,AI Connected Workspace,Den,9
https://attio.com/apps/dimedove,apps,Dimedove Integration | Attio,Qualify leads at scale.,Dimedove,9
https://attio.com/apps/etropo,apps,Etropo Integration | Attio,Modern and efficient way to manage your marketing budget.,Etropo,9
https://attio.com/apps/fastnai,apps,fastn.ai Integration | Attio,Unified API to embed and manage SaaS integrations.,fastn.ai,9
https://attio.com/apps/fibbler,apps,Fibbler Integration | Attio,Match LinkedIn Ads data to CRM accounts and prove ROI,Fibbler,9
https://attio.com/apps/fireflies,apps,Fireflies.ai Integration | Attio,"Automatically send meeting notes, tasks, and more to Attio",Fireflies.ai,9
https://attio.com/apps/first-distro,apps,First Distro Integration | Attio,Prevent churn. Increase retention.,First Distro,9
https://attio.com/apps/flowla,apps,Flowla Integration | Attio,"Deal rooms for Attio, with auto sync and engagement tracking",Flowla,9
https://attio.com/apps/funnelstory,apps,FunnelStory Integration | Attio,FunnelStory is an AI Customer Super­Intelligence platform,FunnelStory,9
https://attio.com/apps/gmail,apps,Gmail Integration | Attio,Sync your workspace to your Gmail and Google Calendar,Gmail,9
https://attio.com/apps/google-meet,apps,Google Meet Integration | Attio,Keep your Attio workspace and team connected with Google Meet,Google Meet,9
https://attio.com/apps/granola,apps,Granola Integration | Attio,"Your AI-powered meeting notes, added to Attio",Granola,9
https://attio.com/apps/helios,apps,Helios Integration | Attio,The AI-native workflow automation platform,Helios,9
https://attio.com/apps/heystream,apps,HeyStream Integration | Attio,The live streaming platform built for B2B growth,HeyStream,9
https://attio.com/apps/housecat,apps,Housecat Integration | Attio,The easiest way to build automations and workflows,Housecat,9
https://attio.com/apps/howdy-go,apps,HowdyGo Integration | Attio,Interactive product demo software for go-to-market teams,HowdyGo,9
https://attio.com/apps/hyperline,apps,Hyperline Integration | Attio,The new standard for revenue management,Hyperline,9
https://attio.com/apps/integrately,apps,Integrately Integration | Attio,Integrately - No code automation platform ,Integrately,9
https://attio.com/apps/jet-admin-apps,apps,Jet Admin Integration | Attio,No-Code Web App Builder,Jet Admin,9
https://attio.com/apps/just-call,apps,JustCall Integration | Attio,"The smarter way to connect, with AI insights built in.",JustCall,10
https://attio.com/apps/klavis-ai,apps,Klavis AI Integration | Attio,Open Source MCP Integrations for AI Applications,Klavis AI,9
https://attio.com/apps/konnectify,apps,Konnectify Integration | Attio,Connect Attio to your other apps and automate workflows,Konnectify,9
https://attio.com/apps/krisp-call,apps,KrispCall Integration | Attio,KrispCall is a cloud telephony system for modern businesses.,KrispCall,9
https://attio.com/apps/launchyfi,apps,Launchyfi Integration | Attio,Seamlessly sync Attio with Launchyfi to power AI GTM,Launchyfi,9
https://attio.com/apps/luo,apps,Luo Integration | Attio,Your work runs on Luo,Luo,9
https://attio.com/apps/magpai,apps,Magpai Integration | Attio,Workflows that don't feel like work.,Magpai,9
https://attio.com/apps/mailchimp,apps,Mailchimp Integration | Attio,Automate Mailchimp with Attio automations,Mailchimp,9
https://attio.com/apps/maple-billing,apps,Measure Integration | Attio,Spin up contracts and automate billing for your contacts,Measure,9
https://attio.com/apps/meet-record,apps,Outdoo AI Integration | Attio,Build top sales teams with AI-driven meeting insights,Outdoo AI,9
https://attio.com/apps/meetgeekai,apps,MeetGeek Integration | Attio,Automatically send meeting notes and tasks to Attio,MeetGeek,9
https://attio.com/apps/microsoft-teams,apps,Microsoft Teams Integration | Attio,Connect Attio to Microsoft Teams and manage your contacts and meetings,Microsoft Teams,11
https://attio.com/apps/miniti,apps,miniti Integration | Attio,AI live meeting assistant and speech coach,miniti,9
https://attio.com/apps/mixmax,apps,Mixmax Integration | Attio,Automate Mixmax with Attio automations,Mixmax,9
https://attio.com/apps/mobile-first-integrations-allo,apps,Allo Integration | Attio,"Get phone numbers with unlimited calls, synced to Attio",Allo,9
https://attio.com/apps/monetize-now,apps,MonetizeNow Integration | Attio,"AI-powered CPQ, Billing, Metering for omni-channel B2B SaaS",MonetizeNow,9
https://attio.com/apps/nomi,apps,Nomi Integration | Attio,AI Sales Copilot: Real-time call guidance.,Nomi,9
https://attio.com/apps/obvious,apps,Obvious Integration | Attio,The gap between your potential and your tools just closed,Obvious,9
https://attio.com/apps/outfunnel,apps,Outfunnel Integration | Attio,"Connect Attio to email marketing tools, databases, and forms",Outfunnel,9
https://attio.com/apps/outlook,apps,Outlook Integration | Attio,Sync your workspace to Outlook to keep your team aligned,Outlook,9
https://attio.com/apps/outreach,apps,Outreach Integration | Attio,Automate email sequences from Attio,Outreach,9
https://attio.com/apps/paid,apps,Paid Integration | Attio,"Quote to billing, all in Attio",Paid,9
https://attio.com/apps/pandadoc,apps,PandaDoc Integration | Attio,"Streamline documents end-to-end, without ever leaving Attio",PandaDoc,9
https://attio.com/apps/partnero,apps,Partnero Integration | Attio,"Keep affiliates, deals, and commissions in sync",Partnero,9
https://attio.com/apps/permute,apps,Permute Integration | Attio,AI-native executive intelligence and automations platform,Permute,9
https://attio.com/apps/pipedream,apps,Pipedream Integration | Attio,Build and deploy AI agents for Attio with Pipedream,Pipedream,9
https://attio.com/apps/pollen,apps,Pollen Integration | Attio,AI agents for customer success,Pollen,9
https://attio.com/apps/productbet,apps,Productbet Integration | Attio,ProductBet connects your existing tools and uses AI to find ,Productbet,9
https://attio.com/apps/prompt-ql,apps,PromptQL Integration | Attio,Multiplayer AI with wiki,PromptQL,9
https://attio.com/apps/quo,apps,Quo Integration | Attio,The best phone system for growth,Quo,9
https://attio.com/apps/reached,apps,Reached Integration | Attio,"3x more conversations, twice as fast.",Reached,9
https://attio.com/apps/relay-app,apps,Relay.app Integration | Attio,The easiest way for everyone to build AI agents.,Relay.app,9
https://attio.com/apps/ringcentral,apps,RingCentral Integration | Attio,Make phone calls,RingCentral,9
https://attio.com/apps/ringee-io,apps,Ringee.io Integration | Attio,Make calls from Attio with Ringee and sync call activity,Ringee.io,9
https://attio.com/apps/ringover-integration,apps,Ringover Integration | Attio,Turn every call & exchange into AI-powered Attio insights,Ringover,9
https://attio.com/apps/scoutos,apps,Scoutos Integration | Attio,"Build AI agents that automate workflows, connect tools ",Scoutos,9
https://attio.com/apps/segment,apps,Segment Integration | Attio,Create and update records in Attio using Segment event data,Segment,9
https://attio.com/apps/segmetrics,apps,Segmetrics Integration | Attio,Uncover the hidden profit in every part of your funnel,Segmetrics,9
https://attio.com/apps/semblyai,apps,Sembly AI Integration | Attio,"Turn meetings into CRM notes, tasks & contacts",Sembly AI,9
https://attio.com/apps/sequence,apps,Sequence Integration | Attio,"Modern quotes, contracts and billing for AI and SaaS",Sequence,9
https://attio.com/apps/sim,apps,Sim Integration | Attio,"Build, deploy, and manage AI Agents",Sim,9
https://attio.com/apps/slack,apps,Slack Integration | Attio,Ask anything and trigger workflows from Slack. ,Slack,9
https://attio.com/apps/slashy,apps,Slashy Integration | Attio,AI-native email client with first-party Attio integration,Slashy,9
https://attio.com/apps/solvimon,apps,Solvimon Integration | Attio,Integration for Solvimon quote to cash solution,Solvimon,9
https://attio.com/apps/speck,apps,Speck Integration | Attio,The Ambient Agent for Your Computer,Speck,9
https://attio.com/apps/spiich,apps,Spiich Integration | Attio,AI sales assistant,Spiich,9
https://attio.com/apps/spinach-ai,apps,Spinach AI Integration | Attio,Supercharge your meetings with the power of AI.,Spinach AI,9
https://attio.com/apps/stilla,apps,Stilla Integration | Attio,Let AI closes the loop: customer request → ship → close deal,Stilla,9
https://attio.com/apps/stimulir,apps,Stimulir Integration | Attio,Agent Business OS,Stimulir,9
https://attio.com/apps/stripe-invoicing,apps,Stripe Invoicing Integration | Attio,Streamline billing with Stripe invoicing directly in Attio,Stripe Invoicing,9
https://attio.com/apps/super,apps,Super Integration | Attio,AI Search on your Attio data + all your company tools,Super,9
https://attio.com/apps/synter,apps,Synter Integration | Attio,"Synter Media AI, sync your CRM data to build targeted ads",Synter,9
https://attio.com/apps/teammates,apps,Teammates Integration | Attio,Empower your virtual workforce to manage your sales process,Teammates,9
https://attio.com/apps/tinct,apps,Tinct Integration | Attio,Personalize your landing pages for every company you target,Tinct,9
https://attio.com/apps/turnstile,apps,Turnstile Integration | Attio,Complete quote-to-cash for sales led startups in minutes,Turnstile,9
https://attio.com/apps/typeform,apps,Typeform Integration | Attio,Respond to Typeform form submissions inside Attio,Typeform,9
https://attio.com/apps/veck,apps,Veck Integration | Attio,Send Veck projects to Attio as deals,Veck,9
https://attio.com/apps/venta-ai,apps,Venta AI Integration | Attio,The compliant AI colleague for sales teams in Europe,Venta AI,9
https://attio.com/apps/zams,apps,Zams Integration | Attio,Run your sales stack from Attio in plain English.,Zams,9
https://attio.com/apps/zapier,apps,Zapier Integration | Attio,Connect Attio to thousands of services and build powerful automations,Zapier,9
https://attio.com/apps/zoom,apps,Zoom Integration | Attio,Connect Attio to Zoom to keep your workspace coordinated,Zoom,11
https://attio.com/blog,blog,Insights & updates | Attio Blog,"Learn more about Attio, CRM, and GTM from members of our team and industry-leading experts.",,9
https://attio.com/careers,careers,Careers | Attio,Looking for your next challenge? Changing paradigms isn't easy and we're looking for more exceptional people to join the team and change CRM forever.,Careers,13
https://attio.com/changelog,changelog,2026 | Attio Changelog,"All Attio product updates, feature releases, and improvements from 2026.",What’s new,20
https://attio.com/contact/sales,contact,Talk to Sales | Attio,See how Attio can power your GTM motion with a product expert.,Talk to Sales | Talk to Sales,8
https://attio.com/customers,customers,Customers | Attio,Discover how thousands of companies use Attio to scale their business.,Customers,15
https://attio.com/download,download,Downloads | Attio,"Attio is available for iOS, Android, and Chrome.",Desktop & mobile,7
https://attio.com/engineering/blog,engineering,Engineering Blog | Attio,"How our engineering team builds the infrastructure, systems, and interfaces on our mission to redefine CRM.",,8
https://attio.com/engineering/blog/introducing-universal-context,engineering,Introducing Universal Context™,Universal Context is the first system in any CRM to provide External Consistency for AI agents.,Introducing Universal Context,12
https://attio.com/experts,experts,Hire an expert | Attio,Supercharge your go-to-market motion by working with an Attio Expert. Get hands-on guidance to unlock your team's full potential.,Elevate your GTM with an expert.,20
https://attio.com/help,help,How can we help? | Attio Help Center,Get answers to common questions on all things Attio,How can we help?,7
https://attio.com/help/academy,help,Academy | Attio Help Center,"Get started with Attio in a few short videos. Connect your inbox, set up your pipelines, and start using Attio's tools across your GTM team.",Attio Academy,6
https://attio.com/help/reference/attio-101,help,Attio 101 | Attio Help Center,Begin your journey with the CRM for modern go-to-market teams.,Attio 101,6
https://attio.com/legal/privacy,legal,Privacy Policy | Attio,"We are committed to providing an environment that is safe, secure, and available to all of our customers all the time.",Privacy Policy,16
https://attio.com/legal/services-agreement,legal,Services Agreement,By logging into your Attio account you agree to be bound by our Services Agreement.,Attio Services Agreement,20
https://attio.com/partners,partners,Partner Programs | Attio,"From building technology around our platform to creating content about Attio, we have a program for every need.",Partner programs,12
https://attio.com/partners/app-partners,partners,App Partner Program | Attio,Develop custom integrations to expand the Attio ecosystem.,App partners,11
https://attio.com/platform/agents,platform,Agents,"Attio is the AI CRM with agents that qualify leads, brief reps for every call, and surface signals, built on Universal Context for scaling revenue teams.",Infinite scale,10
https://attio.com/platform/ai,platform,Embedded intelligence | Attio,"Build powerful systems with Attio’s AI features. Transform complex GTM tasks into effortless, intelligent workflows.",Embedded intelligence | Embedded intelligence,16
https://attio.com/platform/ask,platform,Ask Attio | Attio,Ask more from CRM.,Ask Attio.,11
https://attio.com/platform/call-intelligence,platform,Attio | Call Intelligence,"Every conversation captured, summarized, and synced to your CRM — instantly.",Call Intelligence,17
https://attio.com/platform/data,platform,Data structure & syncing | Attio,"Model your data structure, get automatic enrichment, and syncing from your integrations. Attio gives you complete control to build the perfect CRM.",Data model,17
https://attio.com/platform/developers,platform,Attio | Developer Platform,Attio is the CRM for developers.,[ Developer Platform ] | [ Developer Platform ] | [ Developer Platform ],9
https://attio.com/platform/reporting,platform,Reporting | Attio,"Real-time reporting for go-to-market teams. Create bar, funnel, pie, and more. Attio transforms millions of data points into insights for your entire team.",Reporting,10
https://attio.com/platform/sequences,platform,Sequences | Attio,Go from first touch to final signature with perfectly crafted emails delivered right on cue.,Sequences,15
https://attio.com/pricing,pricing,Pricing | Attio,"See the differences between our plans. Attio pricing and feature comparisons for Attio Free, Plus, Pro, and Enterprise plans.",From zero to IPO.,16
https://attio.com/redefine,redefine,Redefining CRM | Attio,"Customer relationship magic: A CRM that works for you, not the other way around.",Customer relationship magic.,3
https://attio.com/refer,refer,Referral Program | Attio,Join Attio's referral program and unlock exclusive rewards! Share your unique code with your network.,Referral program,11
https://attio.com/solutions/deal-flow-management-software,solutions,Attio: Ask more from CRM,"Powerful, flexible and data-driven, Attio makes it easy to build the exact CRM your business needs.",Deal flow CRM,13
https://attio.com/solutions/startup-crm,solutions,Attio: Ask more from CRM,"Powerful, flexible and data-driven, Attio makes it easy to build the exact CRM your business needs.",CRM for startups,11
https://attio.com/startups,startups,Startup Program | Attio,Discover why ambitious startups love Attio. The CRM for the next generation of builders. Get up to 80% off one year. ,Startup program | 80% off Attio. Benefits built for startups.,11
https://attio.com/templates,templates,Automation Templates | Attio,"Automate your GTM efforts with Attio Automations. Search pre-built workflow templates for Sales, PLG, PLS, and Revenue Operations.",CRM templates library,7
