url,section,title,description,h1,h2_count
https://www.myaifrontdesk.com/,home,"AI Receptionist: Answer Calls, Text, Email & Sync CRM 24/7","Frontdesk: 20+ AI agents in one platform. AI Phone Receptionist, AI CRM, AI Email Agent & more. Answers calls 24/7, captures every lead. Start free.",The easiest way to grow your business. respond to everything. reengage customers. capture every lead. respond to everything. know your business. earn more revenue. grow your business.,20
https://www.myaifrontdesk.com/activecampaign-alternative,activecampaign-alternative,Best ActiveCampaign Alternative (2026): The AI CRM That Fil…,"Looking for a ActiveCampaign alternative? Frontdesk auto-enriches every lead from real calls, texts, and emails, start for free, AI agents included. Compare si…",The ActiveCampaign alternative that fills itself in.,17
https://www.myaifrontdesk.com/ai-crm,ai-crm,AI CRM: Auto-Enriching Pipeline for Sales Teams,"Frontdesk AI CRM centralizes every call, text, email, and chat into one auto-enriched timeline per lead. With AI-scored pipeline and built-in agents.",AI CRM: every lead auto-enriched,17
https://www.myaifrontdesk.com/ai-receptionist,ai-receptionist,AI Receptionist: 24/7 Virtual Answering Service,"Frontdesk's 24/7 AI virtual answering service answers every call, qualifies leads, books appointments, and syncs your CRM. The intelligent AI receptionist trus…",AI Receptionist : 24/7 Virtual Answering Service,20
https://www.myaifrontdesk.com/attio-alternative,attio-alternative,Best Attio Alternative (2026): The AI CRM That Fills Itself…,"Looking for a Attio alternative? Frontdesk auto-enriches every lead from real calls, texts, and emails, start for free, AI agents included. Compare side by sid…",The Attio alternative that fills itself in.,17
https://www.myaifrontdesk.com/best-crm-for,best-crm-for,Best CRM by Industry (2026): The AI CRM That Fills Itself In,"The best CRM for your industry. Frontdesk auto-enriches every contact from real calls, texts, and emails, start for free, AI agents included. Compare by indust…",The best CRM for the way you work.,17
https://www.myaifrontdesk.com/blog-home,blog-home,"Frontdesk Blog, AI Receptionist Playbooks","Read Frontdesk articles on AI call answering, lead capture, appointment reminders, industry workflows, and how teams centralize phone, SMS, and chat.",Insights & guides,20
https://www.myaifrontdesk.com/blogs/archive,blogs,Article Archive. Every Frontdesk page in one place,"A complete HTML sitemap of every Frontdesk page and article, organized by section. Use this index to jump directly to any product page, industry guide, or blog…",Every Frontdesk page,16
https://www.myaifrontdesk.com/close-crm-alternative,close-crm-alternative,Best Close Alternative (2026): The AI CRM That Fills Itself…,"Looking for a Close alternative? Frontdesk auto-enriches every lead from real calls, texts, and emails, start for free, AI agents included. Compare side by sid…",The Close alternative that fills itself in.,17
https://www.myaifrontdesk.com/contact-sales,contact-sales,,AI-powered call handling solution,,0
https://www.myaifrontdesk.com/copper-crm-alternative,copper-crm-alternative,Best Copper Alternative (2026): The AI CRM That Fills Itsel…,"Looking for a Copper alternative? Frontdesk auto-enriches every lead from real calls, texts, and emails, start for free, AI agents included. Compare side by si…",The Copper alternative that fills itself in.,17
https://www.myaifrontdesk.com/crm-glossary,crm-glossary,"CRM Glossary: Every Sales & CRM Term, Defined","Clear definitions of every CRM, sales pipeline, lead, and AI CRM term. From lead scoring to pipeline velocity, the complete glossary for CRM buyers.",The CRM Glossary,20
https://www.myaifrontdesk.com/crm-glossary/call-summary,crm-glossary,AI Call Summary: Definition & Meaning | CRM Glossary,"An automatic, structured recap of what happened on a call.",AI Call Summary,13
https://www.myaifrontdesk.com/crm-glossary/conversation-intelligence,crm-glossary,Conversation Intelligence: Definition & Meaning | CRM Gloss…,"AI that analyzes calls and messages to extract insights, coaching, and CRM data.",Conversation Intelligence,13
https://www.myaifrontdesk.com/crm-glossary/crm-migration,crm-glossary,CRM Migration: Definition & Meaning | CRM Glossary,Moving your data and workflows from one CRM to another.,CRM Migration,13
https://www.myaifrontdesk.com/crm-glossary/lead-enrichment,crm-glossary,Lead Enrichment: Definition & Meaning | CRM Glossary,"Adding context to a lead record, such as intent, fit, company data, and conversation history.",Lead Enrichment,13
https://www.myaifrontdesk.com/crm-glossary/lead-scoring,crm-glossary,Lead Scoring: Definition & Meaning | CRM Glossary,"Ranking leads by how likely they are to convert, so reps work the best ones first.",Lead Scoring,13
https://www.myaifrontdesk.com/crm-glossary/pipeline-velocity,crm-glossary,Pipeline Velocity: Definition & Meaning | CRM Glossary,How quickly deals move through your pipeline and generate revenue.,Pipeline Velocity,13
https://www.myaifrontdesk.com/crm-glossary/sales-cadence,crm-glossary,Sales Cadence: Definition & Meaning | CRM Glossary,"A scheduled sequence of touches, calls, emails, texts, to work a lead.",Sales Cadence,13
https://www.myaifrontdesk.com/crm-glossary/speed-to-lead,crm-glossary,Speed to Lead: Definition & Meaning | CRM Glossary,How fast you respond to a new lead after they reach out.,Speed to Lead,13
https://www.myaifrontdesk.com/crm-glossary/system-of-record,crm-glossary,System of Record: Definition & Meaning | CRM Glossary,The single authoritative source for customer data across a business.,System of Record,13
https://www.myaifrontdesk.com/crm-glossary/what-is-a-sales-pipeline,crm-glossary,Sales Pipeline: Definition & Meaning | CRM Glossary,"A visual representation of where every deal stands in your sales process, stage by stage.",Sales Pipeline,13
https://www.myaifrontdesk.com/crm-glossary/what-is-an-ai-crm,crm-glossary,AI CRM: Definition & Meaning | CRM Glossary,"A CRM that uses AI to populate records, score leads, and act on conversations automatically.",AI CRM,13
https://www.myaifrontdesk.com/crm-glossary/what-is-crm,crm-glossary,CRM (Customer Relationship Management): Definition & Meanin…,Software that stores and manages every interaction a business has with its customers and prospects.,CRM (Customer Relationship Management),13
https://www.myaifrontdesk.com/crm-reimagined-for-the-ai-age,crm-reimagined-for-the-ai-age,AI-Native CRM. Frontdesk vs Legacy Stacks,"Compare legacy CRM busywork with Frontdesk AI CRM: structured capture from every call and message, contextual follow-up, and revenue signals without manual ent…",CRM Reimagined for the AI Age,16
https://www.myaifrontdesk.com/customer-stories,customer-stories,Customer stories | Frontdesk,"Case studies from brokerages, builders, clinics, manufacturers, and operators: measurable gains in call coverage, routing, referrals, and revenue, with Frontde…",Customer stories with numbers behind them,20
https://www.myaifrontdesk.com/features,features,AI Front Desk Features | Advanced Virtual AI Receptionist,"AI Front Desk features 24/7 AI call answering, voice and language control, SMS workflows, integrations, analytics, and scalable multilingual reception.",Everything your AI receptionist can do,20
https://www.myaifrontdesk.com/freshsales-alternative,freshsales-alternative,Best Freshsales Alternative (2026): The AI CRM That Fills I…,"Looking for a Freshsales alternative? Frontdesk auto-enriches every lead from real calls, texts, and emails, start for free, AI agents included. Compare side b…",The Freshsales alternative that fills itself in.,17
https://www.myaifrontdesk.com/get-the-2026-centralization-report,get-the-2026-centralization-report,2026 Centralization Report. Frontdesk,"Download Frontdesk’s 2026 report on how mid-market operators consolidate locations, teams, and customer-ops software into one model, and what it saves.",,11
https://www.myaifrontdesk.com/gohighlevel-alternative,gohighlevel-alternative,Best GoHighLevel Alternative (2026): The AI CRM That Fills…,"Looking for a GoHighLevel alternative? Frontdesk auto-enriches every lead from real calls, texts, and emails, start for free, AI agents included. Compare side…",The GoHighLevel alternative that fills itself in.,17
https://www.myaifrontdesk.com/hubspot-alternative,hubspot-alternative,Best HubSpot Alternative (2026): The AI CRM That Fills Itse…,"Looking for a HubSpot alternative? Frontdesk auto-enriches every lead from real calls, texts, and emails, start for free, AI agents included. Compare side by s…",The HubSpot alternative that fills itself in.,17
https://www.myaifrontdesk.com/industries-we-serve/accounting-firms,industries-we-serve,Accounting Firm AI Receptionist. Frontdesk,"Survive tax season inbound: Frontdesk answers after-hours client calls, books consults, captures intake details, and launches no-show recovery, synced to your…",Never miss a client. Even at 2 AM during tax season,16
https://www.myaifrontdesk.com/industries-we-serve/automotive,industries-we-serve,Automotive AI Receptionist. Frontdesk,"Capture after-hours repair calls, book service appointments, and recover no-shows with Frontdesk AI phone, SMS, and shop-ready CRM workflows for dealers and ga…",Fill your service bays while you sleep,17
https://www.myaifrontdesk.com/industries-we-serve/legal,industries-we-serve,Law Firm AI Receptionist & Intake. Frontdesk,"Capture urgent intakes after hours: Frontdesk answers legal calls 24/7, classifies matter type, books consults, and runs no-show recovery with a unified client…",Capture every legal client while your team sleeps,16
https://www.myaifrontdesk.com/industries-we-serve/real-estate,industries-we-serve,Real Estate AI Receptionist. Frontdesk,"Win speed-to-lead: Frontdesk answers brokerage calls 24/7, qualifies buyers and sellers, books showings into your calendar, and runs no-show recovery with CRM…",Never miss a real estate lead again,16
https://www.myaifrontdesk.com/industries-we-serve/residential-property-management,industries-we-serve,Residential PM AI Receptionist. Frontdesk,"Lease and support residents faster: Frontdesk handles after-hours leasing calls, tours, maintenance intake, and no-show follow-ups with unified CRM timelines f…",Fill vacant apartments while your team sleeps,16
https://www.myaifrontdesk.com/keap-alternative,keap-alternative,Best Keap Alternative (2026): The AI CRM That Fills Itself…,"Looking for a Keap alternative? Frontdesk auto-enriches every lead from real calls, texts, and emails, start for free, AI agents included. Compare side by side.",The Keap alternative that fills itself in.,17
https://www.myaifrontdesk.com/monday-crm-alternative,monday-crm-alternative,Best monday CRM Alternative (2026): The AI CRM That Fills I…,"Looking for a monday CRM alternative? Frontdesk auto-enriches every lead from real calls, texts, and emails, start for free, AI agents included. Compare side b…",The monday CRM alternative that fills itself in.,17
https://www.myaifrontdesk.com/multifamily,multifamily,"AI for Multifamily. Leasing, Maintenance, Renewals, Collect…","Frontdesk is the AI front office for multifamily. 24/7 leasing, maintenance, renewals, and collections. Integrated with Yardi, RealPage, Entrata, AppFolio, Bui…",The AI front office that runs your entire multifamily portfolio,15
https://www.myaifrontdesk.com/multifamily/ai-for-property-managers,multifamily,AI for Property Managers | Frontdesk Property Manager AI Software,"AI for property managers — 24/7 voice + SMS that answers calls, books tours, intakes maintenance, chases delinquency, and runs renewals. Property manager AI so…","AI for property managers that handles the calls, tours, and follow-up your team can't",20
https://www.myaifrontdesk.com/multifamily/ai-lease-renewal-outreach,multifamily,AI Lease Renewal Outreach for Multifamily | Frontdesk,"AI-powered lease renewal campaigns that lift renewal rate 5–15%. Integrates with Yardi, RealPage, Entrata, AppFolio, Buildium, ResMan.",Lift renewal rate 5–15% with proactive AI outreach,20
https://www.myaifrontdesk.com/multifamily/ai-leasing-agent,multifamily,AI Leasing Agent for Multifamily. 24/7 Lead Capture | Frontdesk,"AI leasing agent for multifamily that answers calls, chats, and ILS leads 24/7. Integrates with Yardi, RealPage, Entrata, AppFolio, Buildium, ResMan.","The AI leasing agent that fills units 24/7, across every community",20
https://www.myaifrontdesk.com/multifamily/ai-maintenance-request-intake,multifamily,"AI Maintenance Intake for Multifamily — Yardi, RealPage, Entrata | Frontdesk","24/7 AI maintenance request intake with emergency triage. Creates work orders in Yardi, RealPage, Entrata, AppFolio, Buildium, ResMan automatically.","AI maintenance intake that triages, routes, and schedules 24/7",20
https://www.myaifrontdesk.com/multifamily/ai-rent-delinquency-collections,multifamily,AI Rent Delinquency & Collections for Multifamily | Frontdesk,"AI-powered rent delinquency outreach, payment-plan negotiation, and collections. Syncs with Yardi, RealPage, Entrata, AppFolio, Buildium, ResMan.",Reduce delinquency without adding collections headcount,20
https://www.myaifrontdesk.com/multifamily/ai-tour-no-show-recovery,multifamily,AI Tour No-Show Recovery for Multifamily | Frontdesk,"Recover 30–50% of missed apartment tours with AI voice, SMS, and email follow-up. Works with Yardi, RealPage, Entrata, AppFolio, Buildium, ResMan.",Recover 30–50% of missed apartment tours automatically,20
https://www.myaifrontdesk.com/multifamily/appfolio-ai-integration,multifamily,AppFolio AI Integration. AI for Property Manager & Realm-X | Frontdesk,"AI leasing, maintenance, renewals, and collections that integrate natively with AppFolio Property Manager and Realm-X copilot.",AI front office that works natively with AppFolio,20
https://www.myaifrontdesk.com/multifamily/appfolio-leasing-ai,multifamily,AppFolio Leasing AI | Frontdesk AI for AppFolio Users,"Add 24/7 AI voice, SMS, and outbound to AppFolio. Frontdesk integrates with AppFolio to fill the gaps Realm-X doesn't cover — speed-to-lead, after-hours, nurtu…",Supercharge AppFolio with 24/7 AI leasing voice and outbound,20
https://www.myaifrontdesk.com/multifamily/buildium-ai-integration,multifamily,Buildium AI Integration. AI for Property Manager & HOA | Frontdesk,"AI leasing, maintenance, renewals, and HOA support that integrate natively with Buildium Property Manager and Buildium HOA.",AI front office that works natively with Buildium,20
https://www.myaifrontdesk.com/multifamily/elise-ai-alternative,multifamily,EliseAI alternative — Frontdesk LLM-native leasing AI,"Honest comparison of EliseAI vs Frontdesk. EliseAI was built pre-LLM and bolted language models on top. Frontdesk was built in 2023, natively on LLMs. Voice, S…",The LLM-native alternative to EliseAI,20
https://www.myaifrontdesk.com/multifamily/entrata-ai-integration,multifamily,Entrata AI Integration. AI for Entrata Core & ELI+ | Frontdesk,"AI leasing, maintenance, renewals, and collections that integrate natively with Entrata Core and Entrata Leasing AI (ELI+).",AI front office that works natively with Entrata,20
https://www.myaifrontdesk.com/multifamily/funnel-leasing-alternative,multifamily,Funnel Leasing alternative — Frontdesk LLM-native leasing AI,"Honest comparison of Funnel Leasing vs Frontdesk. Funnel Leasing was built pre-LLM and bolted language models on top. Frontdesk was built in 2023, natively on…",The LLM-native alternative to Funnel Leasing,20
https://www.myaifrontdesk.com/multifamily/knock-crm-alternative,multifamily,Knock CRM alternative — Frontdesk LLM-native leasing AI,"Honest comparison of Knock CRM vs Frontdesk. Knock CRM was built pre-LLM and bolted language models on top. Frontdesk was built in 2023, natively on LLMs. Voic…",The LLM-native alternative to Knock CRM,20
https://www.myaifrontdesk.com/multifamily/leasehawk-alternative,multifamily,LeaseHawk alternative — Frontdesk LLM-native leasing AI,"Honest comparison of LeaseHawk vs Frontdesk. LeaseHawk was built pre-LLM and bolted language models on top. Frontdesk was built in 2023, natively on LLMs. Voic…",The LLM-native alternative to LeaseHawk,20
https://www.myaifrontdesk.com/multifamily/realpage-ai-integration,multifamily,"RealPage AI Integration. AI for OneSite, Knock & AIRM | Frontdesk","AI leasing, maintenance, renewals, and collections that integrate natively with RealPage OneSite, Knock CRM, and AI Revenue Management.",AI front office that works natively with RealPage,20
https://www.myaifrontdesk.com/multifamily/reports,multifamily,Multifamily AI Reports & Research | Frontdesk,"Multifamily AI industry reports, benchmarks, comparisons, and buyer guides. EliseAI vs Funnel Leasing, Yardi vs RealPage vs Entrata, AI ROI in multifamily.","Industry reports, ROI benchmarks, and AI comparisons for multifamily operators",12
https://www.myaifrontdesk.com/multifamily/tools,multifamily,"Free Multifamily AI Tools. ROI Calculator, Prompt Pack & More | Frontdesk","Free interactive AI tools for multifamily teams: ROI calculator, AI prompt library, lead scripts, and readiness quiz. Built for Yardi, RealPage, Entrata, AppFolio, Buildium, and ResMan operators.","AI tools, calculators & prompt packs for multifamily teams",13
https://www.myaifrontdesk.com/multifamily/tools/prompt-library,multifamily,"Multifamily AI Prompt Library. Leasing, Maintenance, Renewals | Frontdesk","Free copy-paste AI prompts for multifamily teams: leasing qualification, tour booking, maintenance intake, rent collections, and lease renewal. Tuned for Yardi, RealPage, Entrata, and AppFolio.",Multifamily AI Prompt Library,14
https://www.myaifrontdesk.com/multifamily/tools/roi-calculator,multifamily,Multifamily AI ROI Calculator. Hours & Cost Saved | Frontdesk,"Free interactive calculator: estimate leasing hours saved, cost savings, and payback period from running an AI receptionist across your multifamily portfolio.",Multifamily AI ROI Calculator,14
https://www.myaifrontdesk.com/multifamily/yardi-ai-integration,multifamily,"Yardi AI Integration. AI for Voyager, Breeze & RentCafe | Frontdesk","AI leasing, maintenance, renewals, and collections that integrate natively with Yardi Voyager, Breeze, and RentCafe. Replaces Chat IQ limitations.",The AI front office that works natively with Yardi,20
https://www.myaifrontdesk.com/multifamily/yardi-ai-leasing-agent,multifamily,Yardi AI Leasing Agent | Frontdesk for Yardi Voyager,"AI leasing agent built for Yardi Voyager users. 24/7 voice, SMS, and outbound that integrate with Yardi — filling the gaps Chat IQ doesn't cover.",The AI leasing agent that supercharges Yardi Voyager,20
https://www.myaifrontdesk.com/partner-program,partner-program,Partner with AI Frontdesk. Partner Program,"Join the AI Frontdesk Partner Program. Apply in minutes, get reviewed by our partnerships team, and schedule your first onboarding call.",Partner with AI Frontdesk,14
https://www.myaifrontdesk.com/pipedrive-alternative,pipedrive-alternative,Best Pipedrive Alternative (2026): The AI CRM That Fills It…,"Looking for a Pipedrive alternative? Frontdesk auto-enriches every lead from real calls, texts, and emails, start for free, AI agents included. Compare side by…",The Pipedrive alternative that fills itself in.,17
https://www.myaifrontdesk.com/platform/ai-calendar,platform,AI Calendar. Appointments that book themselves,"Frontdesk AI Calendar books appointments live during the conversation. Checking your real availability across Google and Outlook, confirming on the call, and f…","AI Scheduling. Book appointments 24/7 from phone, chat, and web.",18
https://www.myaifrontdesk.com/platform/ai-crm,platform,AI CRM. The CRM that updates itself,"Frontdesk AI CRM stays current automatically, every call, text, chat, and email updates the record while the conversation is still happening.","AI CRM. Centralize every lead, updated automatically.",19
https://www.myaifrontdesk.com/platform/ai-phone-receptionist,platform,AI Phone Receptionist: Automated Call Answering & Routing,"Frontdesk's AI phone receptionist answers inbound calls in under a second, routes by intent, books appointments live, and records every call. Keep your existin…",AI Phone Receptionist. Automated call answering and routing for every inbound caller.,19
https://www.myaifrontdesk.com/platform/ai-phone-receptionist/24-7-availability,platform,"24/7 Availability: Answer Every Call After Hours, Weekends,…","Your AI receptionist answers every call at 2am, on weekends, and on holidays with the same quality as a business-hours call.","24/7 Availability: Answer Every Call After Hours, Weekends, and Holidays",15
https://www.myaifrontdesk.com/platform/ai-phone-receptionist/ambient-noise,platform,Ambient Background Noise: Make AI Calls Feel Human,Add subtle room sounds and keyboard typing to AI calls so callers sense a live person on the line. Reduces the robotic feel and improves caller comfort.,Ambient Background Noise: Make AI Calls Feel Human,15
https://www.myaifrontdesk.com/platform/ai-phone-receptionist/api-webhooks,platform,API and Webhooks: Build Custom Integrations with Every Call…,Frontdesk exposes a full REST API and webhook system. Every call event can trigger a webhook to your server with structured JSON.,API and Webhooks: Build Custom Integrations with Every Call Event,15
https://www.myaifrontdesk.com/platform/ai-phone-receptionist/call-memory,platform,Call Memory: Personalize Every Call Using CRM Data,Call memory connects your AI receptionist to your CRM so it knows who is calling before the conversation starts.,Call Memory: Personalize Every Call Using CRM Data,15
https://www.myaifrontdesk.com/platform/ai-phone-receptionist/call-recording,platform,Call Recording: Record and Review Every AI Receptionist Con…,Call recording captures the full audio of every call your AI receptionist handles. Recordings are stored alongside the transcript and call summary.,Call Recording: Record and Review Every AI Receptionist Conversation,15
https://www.myaifrontdesk.com/platform/ai-phone-receptionist/call-transfers,platform,Call Transfer Workflows: Route Calls to the Right Person Ev…,"Create scenario-based call transfer rules. When callers ask about billing, service, or any trigger you define, Frontdesk routes the call to the right number au…",Call Transfer Workflows: Route Calls to the Right Person Every Time,15
https://www.myaifrontdesk.com/platform/ai-phone-receptionist/concurrent-calls,platform,Unlimited Concurrent Calls: Handle Every Caller at Once,Frontdesk handles unlimited simultaneous inbound calls. Every caller gets an immediate response with no hold queue.,Unlimited Concurrent Calls: Handle Every Caller at Once,15
https://www.myaifrontdesk.com/platform/ai-phone-receptionist/custom-commands,platform,Custom AI Prompt: Control How Your Receptionist Talks and A…,"Write plain-English instructions to control your AI receptionist's tone, business rules, topics to avoid, and specific phrasing.",Custom AI Prompt: Control How Your Receptionist Talks and Acts,15
https://www.myaifrontdesk.com/platform/ai-phone-receptionist/extension-digits,platform,Extension Digits: Route Callers to Any Department with Pres…,Extension digits let callers press a number to reach a specific department or person. Configure them in the Extension Digits Builder.,Extension Digits: Route Callers to Any Department with Press-to-Transfer,15
https://www.myaifrontdesk.com/platform/ai-phone-receptionist/intake-forms,platform,Intake Forms: Collect Structured Lead Data During Every Call,Intake forms tell the AI to ask a set of questions during a call and save the answers as a ticket. Use them at call start or trigger them on a specific scenari…,Intake Forms: Collect Structured Lead Data During Every Call,15
https://www.myaifrontdesk.com/platform/ai-phone-receptionist/knowledge-base,platform,Knowledge Base: Train Your AI Receptionist on Your Business…,"Add text, paste a website URL, or upload a PDF and the AI learns to answer caller questions accurately on every call.",Knowledge Base: Train Your AI Receptionist on Your Business in Minutes,15
https://www.myaifrontdesk.com/platform/ai-phone-receptionist/multilingual-support,platform,Multilingual Support: Serve Callers in 20+ Languages Automa…,"Frontdesk detects the caller language and responds natively. English, Spanish, French, Portuguese, Mandarin, and 15+ more languages are supported.",Multilingual Support: Serve Callers in 20+ Languages Automatically,15
https://www.myaifrontdesk.com/platform/ai-phone-receptionist/post-call-sms,platform,Post-Call SMS: Automatically Text Callers After Every Conve…,"Send a text message to the caller immediately after the AI receptionist finishes the conversation. Use it for confirmations, links, or next steps.",Post-Call SMS: Automatically Text Callers After Every Conversation,15
https://www.myaifrontdesk.com/platform/ai-phone-receptionist/pronunciation-guides,platform,Pronunciation Guides: Teach the AI to Say Your Brand Name C…,"Correct how the AI pronounces your company name, product names, staff names, or industry terms it mispronounces by default.",Pronunciation Guides: Teach the AI to Say Your Brand Name Correctly,15
https://www.myaifrontdesk.com/platform/ai-phone-receptionist/spam-blocking,platform,"Spam Blocking: Stop Robocalls, Bots, and Junk Callers Autom…","Frontdesk includes robocall detection, blocked number lists, bot-block phrases, and SMS spam filtering so only real callers reach your AI.","Spam Blocking: Stop Robocalls, Bots, and Junk Callers Automatically",15
